type,last_updated,severity,description,created_by,attachment_path
issue,2026-03-26 18:33:37,low,scroll broke on asset library ui after additions,cal,
issue,2026-03-26 18:33:19,low,,,
feature,2026-03-26 15:38:52,low,"Completely overhaul the tags section in the asset info UI. Display tags in green and anti-tags in red. Below them, show a list of recommended tags in yellow. Add a search bar at the bottom that dynamically updates the recommended list as the user types. Always include a single orange tag at the top of the recommended list that exactly matches the current search input, unless it already exists as a tag or anti-tag. Users must be able to drag tags between all lists (green, red, yellow) in any direction. Double-clicking a tag removes it from its current list. Double-clicking a recommended tag hides it until the panel is reopened. All UI interactions must correctly update and persist the underlying data. Codex must review the attached image to understand the intended layout and behavior before implementing.",,screen_shots/screenshot_1774563755799.bmp
design,2026-03-26 15:27:07,low,"Clean up the animation editor workflow. Remove the geometry and animation dropdowns since they are unused. Remove the anchors button from the geometry dropdown. Remove the configure animations button from the asset info UI. The animation editor should open via tab navigation and appear immediately after the asset info panel. When opened, it must be full screen with no docked asset info panel visible. Do not display the frame or animation navigator while the animation editor is open.",,
issue,2026-03-26 13:59:36,low,"Attack hitbox system is completely broken. It does not render in the editor, is not saved on close, and does not exist at runtime after being added. Assume both hitbox and attack box systems are affected. Codex must analyze the attached screenshot to understand the issue, then trace the full pipeline including creation, rendering, serialization, and runtime loading. Identify and fix the root cause so hitboxes function correctly in both editor and runtime.",,screen_shots/screenshot_1774558685742.bmp
issue,2026-03-26 15:19:42,high,"Movement panel in the asset info editing stack is not functioning. No movement points are displayed and existing movement data is not loaded. Codex must analyze the attached screenshot to understand the issue, then investigate the full pipeline including loading, rendering, editing, and saving. Ensure each animation frame always has default movement data of zero if none exists, and that these points are visible and editable. Fix data formatting and persistence so movement works correctly in the editor, saved data, and runtime.",,screen_shots/screenshot_1774558438498.bmp
