type,last_updated,severity,description,created_by,attachment_path
issue,2026-05-25 21:39:49,low,"Task description is currently empty in docs/tasks.csv. Triage this entry in the in-game TaskEditor (runtime::TaskEditor in ENGINE/runtime/utils/utils/task_editor.cpp), then define a concrete bug/feature scoped to that panel before implementation. Include reproduction steps, affected UI controls (Add Task, per-row DMTextBox/DMDropdown widgets), and acceptance criteria; no engine work should start until this row is specified.",,
issue,2026-05-25 21:39:49,low,"Task description is currently empty in docs/tasks.csv. Use the TaskEditor overlay (opened by AssetsManager task workflow) to capture the missing intent, including impacted runtime/editor systems and the exact panel interactions. Required cleanup: remove this placeholder-only row or replace it with a fully specified issue tied to concrete files/methods so it can be implemented and verified.",,
issue,2026-05-25 21:43:15,low,"Asset Info Stack > Movement Editor: split point interaction into two handles for movement keys with non-zero DY. In RoomEditor movement editing, selecting a point with vertical offset should not snap the full 3D point to floor-projected mouse coordinates. Instead, drag on the ground crosshair handle to edit only X/Z (DX/DZ), and drag the elevated point handle (or wheel Y workflow) to edit only Y (DY). Update hit-testing and drag routing in the RoomEditor movement interaction path and keep RoomMovementToolsPanel numeric fields synchronized. Constraints: preserve existing snap-to-grid behavior for X/Z when snapping is enabled, avoid regressions for DY==0 points, and ensure no unintended floor re-projection of Y-offset points.",,
issue,2026-05-25 21:39:10,low,"Asset Info Stack > Movement Editor path loading bug: when switching animation and path selection, always bind the editor to the selected animation's actual movement_paths data instead of stale or zero-filled frames. Investigate movement path state handoff between animation selection and path UI (RoomEditor subview state + RoomMovementToolsPanel path list callbacks, plus movement payload parsing/building in FrameEditState helpers). Implementation direction: on animation change, rebuild path options from that animation payload, clamp selected_path_index, and refresh visible point/frame data from the newly selected path. Constraints/cleanup: eliminate state leakage from previously viewed animations/paths, keep path counts in sync with movement_paths JSON, and prevent fallback 0,0,0 rows unless the authored path is truly empty.",,
issue,2026-05-25 21:37:43,low,"Asset Info Stack > Movement Editor Y-adjust workflow: fix wheel-based vertical editing so DY updates live and does not alter X/Z. In movement edit mode, mouse-wheel height adjustment should switch visualization from floor grid to XY grid, keep XY grid resolution aligned with floor-grid spacing, and persist XY view until a click exits back to floor grid. Runtime behavior: if snapping is ON, each wheel step snaps to the next resolved 3D Y level at current X/Z; if snapping is OFF, each wheel tick moves Y by exactly 1 pixel/unit. Relevant systems: RoomEditor movement input handling, movement point transform updates, and movement overlay/grid rendering. Constraints: scrolling must never shift horizontal position, DY changes must be immediately visible in viewport and in RoomMovementToolsPanel Y field, and grid mode transitions should be explicit and reversible.",,
issue,2026-04-29 11:53:31,low,"TaskEditor overlay fixes (ENGINE/runtime/utils/utils/task_editor.cpp): (1) clicking Add Task must create exactly one new TaskRow per click (investigate button event edge handling so add_task() is not invoked twice for a single click lifecycle), (2) while any TaskEditor input is active, keyboard/text events must be captured exclusively by TaskEditor and not propagate to gameplay/editor controls in AssetsManager/room input flows, and (3) description DMTextBox must support mouse caret placement so users can click to reposition cursor inside existing text. Constraints/cleanup: preserve current CSV persistence format, keep per-row last_updated updates on real edits only, and avoid breaking dropdown/attachment/delete interactions in the same table row.",,
